<?xml version="1.0" encoding="UTF-8"?>
<personas xmlns:xsi="http://www.w3.org/2001/XMLSchema-instance" xsi:noNamespaceSchemaLocation="ejercicio37.xsd">
    <persona>
        <nombre>Juan</nombre>
        <apellidos>García</apellidos>
        <telefono>924555555</telefono>
    </persona>
    <persona>
        <nombre>Juan</nombre>
        <apellidos>García</apellidos>
        <telefono>924555555</telefono>
    </persona>
</personas>